title,slug,category_id,collection_ids,short_description,long_description,average_rating,review_count,sku,barcode,has_variations,stock_quantity,track_quantity,allow_backorders,sold_count,in_cart_count,weight,height,width,length,weight_unit,dimension_unit,tags,meta_title,meta_desc,type,status
"Wireless Mouse","wireless-mouse",5,"[12,15]","Compact wireless mouse","A high-precision wireless mouse with ergonomic design.",4.2,87,"WM-4521","123456789012",false,320,true,false,120,30,0.0850,4.0000,2.5000,7.0000,"kg","cm","electronics,accessories,mouse","Wireless Mouse - Ergonomic","A high-quality ergonomic wireless mouse for everyday use.","simple",1
"Men's Running Shoes","mens-running-shoes",8,"[22]","","Lightweight and comfortable running shoes with breathable mesh.",4.7,230,,"987654321098",true,150,true,true,95,18,0.9500,12.0000,9.0000,30.0000,"kg","cm","shoes,men,running","Men's Running Shoes","", "variable",1
"Bluetooth Speaker","bluetooth-speaker",4,"[9,10]","Portable Bluetooth speaker","Loud, clear sound with deep bass and 10-hour battery life.",4.5,310,"BS-8834","111222333444",false,80,true,false,200,12,0.4200,7.5000,7.5000,15.0000,"kg","cm","audio,bluetooth,speaker","Bluetooth Speaker - Portable","","simple",1
"Canvas Wall Art","canvas-wall-art",12,"[30]","Modern wall art","Set of 3 framed canvas prints in abstract style.",3.9,58,"ART-9821","555666777888",false,40,false,false,18,3,2.3000,40.0000,60.0000,2.0000,"kg","cm","home,decor,art","Abstract Wall Art","Decorate your space with modern canvas art.","simple",1
"Electric Kettle","electric-kettle",6,"[5,6]","","Fast boiling electric kettle with auto shut-off and 1.7L capacity.",4.1,112,"EK-6753","444555666777",false,90,true,true,75,8,1.2000,25.0000,15.0000,20.0000,"kg","cm","kitchen,appliances,kettle","Electric Kettle","", "simple",1
